{
  "kind": "special",
  "id": "test-rising-talisman",
  "name": "TEST FIXTURE: Rising Talisman (A-section numbers; stun, boxes, Lv 2 step and EX made up; not game content)",
  "status": "proposed",
  "source": "ryo",
  "starter": true,
  "rarity": "common",
  "locked": false,
  "clip": "ryo-rising-talisman",
  "rules": ["A1", "A4", "K1", "K2", "C5"],
  "input": {
    "kata": { "slot": "B", "motion": "623" },
    "kihon": { "slot": "B", "direction": "forward" }
  },
  "card": {
    "plain": "A rising talisman strike that beats jumps.",
    "frames": "5 / 8 / 28 frames, 90 damage, air-invulnerable frames 1-5"
  },
  "ex": {
    "meter_cost": 100,
    "changes": [
      { "target": "damage", "op": "add", "value": 30 }
    ]
  },
  "levels": {
    "1": {
      "frame_data": {
        "startup": 5,
        "active": 8,
        "recovery": 28,
        "damage": 90,
        "hitstun": 30,
        "blockstun": 18,
        "strength": "heavy",
        "hitboxes": [
          { "frames": [6, 13], "rect": { "x": 20, "y": 100, "w": 80, "h": 300 } }
        ],
        "hurtboxes": [
          { "frames": [1, 41], "rect": { "x": -45, "y": 0, "w": 90, "h": 360 } }
        ],
        "properties": {
          "anti_air": true,
          "knockdown": true,
          "invuln": [ { "frames": [1, 5], "against": "air" } ]
        }
      }
    },
    "2": {
      "status": "proposed",
      "tuning": { "target": "damage", "op": "mul_pct", "value": 110 },
      "notes": "Placeholder: the A4 example step (+10% damage). The exact Lv 2 step per special is an open question."
    },
    "3": {
      "evolution": {
        "id": "heaven-seal",
        "name": "Heaven Seal",
        "preset": "heaven-seal",
        "changes": [
          { "target": "properties.launch", "op": "set", "value": true }
        ],
        "card": {
          "plain": "The talisman launches the foe for a follow-up.",
          "frames": "5 / 8 / 28 frames, 90 damage, launches"
        }
      }
    }
  },
  "notes": "TEST FIXTURE (YOK-21). Startup/active/recovery/damage and the air-invulnerable frames 1-5 are the rules.md specials table; everything else is a placeholder. Never copy to data/moves/."
}
