{
  "kind": "special",
  "id": "rising-talisman",
  "name": "Rising Talisman",
  "status": "proposed",
  "source": "ryo",
  "starter": true,
  "rarity": "common",
  "locked": false,
  "clip": "ryo-rising-talisman-strike",
  "rules": [
    "A1",
    "A3",
    "A4",
    "A5",
    "C5",
    "E1",
    "E16",
    "F2",
    "F3",
    "K1",
    "K2",
    "K3",
    "V8"
  ],
  "input": {
    "kata": {
      "slot": "B",
      "motion": "623"
    },
    "kihon": {
      "slot": "B",
      "direction": "forward"
    }
  },
  "card": {
    "plain": "A rising talisman strike that beats jumps.",
    "frames": "5 / 8 / 31 frames, 90 damage, air-invulnerable frames 1-5"
  },
  "ex": {
    "meter_cost": 100,
    "changes": [
      {
        "target": "damage",
        "op": "mul_pct",
        "value": 130
      },
      {
        "target": "properties.knockdown",
        "op": "set",
        "value": true
      }
    ]
  },
  "levels": {
    "1": {
      "frame_data": {
        "startup": 5,
        "active": 8,
        "recovery": 31,
        "damage": 90,
        "hitstun": 24,
        "blockstun": 16,
        "hitboxes": [
          {
            "frames": [
              6,
              13
            ],
            "rect": {
              "x": 30,
              "y": 150,
              "w": 100,
              "h": 230
            }
          }
        ],
        "hurtboxes": [
          {
            "frames": [
              1,
              44
            ],
            "rect": {
              "x": -45,
              "y": 0,
              "w": 90,
              "h": 360
            }
          },
          {
            "frames": [
              5,
              17
            ],
            "rect": {
              "x": 30,
              "y": 230,
              "w": 100,
              "h": 120
            }
          }
        ],
        "properties": {
          "anti_air": true,
          "invuln": [
            {
              "frames": [
                1,
                5
              ],
              "against": "air"
            }
          ]
        }
      },
      "preset": "rising-talisman-lv1"
    },
    "2": {
      "status": "proposed",
      "tuning": {
        "target": "recovery",
        "op": "add",
        "value": -4
      },
      "notes": "Placeholder only (the A4 example step). Real Lv 2 steps are YOK-43's proposals; the designer decides in YOK-41. Not written by YOK-33."
    },
    "3": {
      "evolution": {
        "id": "heaven-seal",
        "name": "Heaven Seal",
        "status": "proposed",
        "preset": "heaven-seal",
        "changes": [
          {
            "target": "properties.launch",
            "op": "set",
            "value": true
          }
        ],
        "card": {
          "plain": "The strike launches the opponent for a follow-up.",
          "frames": "Launches on hit"
        }
      }
    }
  },
  "notes": "Startup 5, active 8 and air-invuln frames 1-5 match the table. Recovery is clip-derived: clip frames_total 44 - 13 = 31; table target 28 (+3, clip wins). Hitbox is tall (chest to above the head) for the anti-air job because the clip reads as a horizontal jab and the arc comes from VFX (clip notes). Hitstun 24, blockstun 16 and the EX (+30% damage, knockdown, 100 meter) are first passes. Lv 2 and Lv 3 are placeholders from other tickets."
}
