{
  "kind": "special",
  "id": "test-spirit-wave",
  "name": "TEST FIXTURE: Spirit Wave (A-section numbers; stun, speed, boxes, Lv 2 step and EX made up; not game content)",
  "status": "proposed",
  "source": "ryo",
  "starter": true,
  "rarity": "common",
  "locked": false,
  "clip": "ryo-spirit-wave",
  "rules": ["A1", "A4", "K1", "K2", "C5"],
  "input": {
    "kata": { "slot": "A", "motion": "236" },
    "kihon": { "slot": "A", "direction": "neutral" }
  },
  "card": {
    "plain": "Throw a wave of spirit ink across the screen.",
    "frames": "13 / — / 30 frames, 60 damage, projectile"
  },
  "ex": {
    "meter_cost": 100,
    "changes": [
      { "target": "projectile.hits", "op": "set", "value": 2 },
      { "target": "projectile.speed", "op": "add", "value": 4 }
    ]
  },
  "levels": {
    "1": {
      "frame_data": {
        "startup": 13,
        "active": null,
        "recovery": 30,
        "damage": 60,
        "hitstun": 20,
        "blockstun": 16,
        "hitboxes": [],
        "hurtboxes": [
          { "frames": [1, 43], "rect": { "x": -45, "y": 0, "w": 90, "h": 360 } }
        ],
        "cancel_windows": [
          { "frames": [14, 20], "on": ["hit", "block", "whiff"] }
        ],
        "properties": {
          "projectile": {
            "spawn_frame": 14,
            "speed": 12,
            "hitbox": { "x": 60, "y": 120, "w": 60, "h": 60 },
            "hits": 1
          }
        }
      }
    },
    "2": {
      "status": "proposed",
      "tuning": { "target": "recovery", "op": "add", "value": -4 },
      "notes": "Placeholder: the A4 example step. The exact Lv 2 step per special is an open question."
    },
    "3": {
      "evolution": {
        "id": "great-wave",
        "name": "Great Wave",
        "preset": "great-wave",
        "changes": [
          { "target": "projectile.absorbs_projectiles", "op": "set", "value": 1 }
        ],
        "card": {
          "plain": "Your wave swallows one enemy projectile and keeps going.",
          "frames": "13 / — / 30 frames, 60 damage, absorbs 1 projectile"
        }
      }
    }
  },
  "notes": "TEST FIXTURE (YOK-21). Startup/recovery/damage are the rules.md specials table; everything else is a placeholder. Real data comes from movesmith after clip-matcher (F2). Never copy to data/moves/."
}
