{
  "kind": "special",
  "id": "spirit-wave",
  "name": "Spirit Wave",
  "status": "proposed",
  "source": "ryo",
  "starter": true,
  "rarity": "common",
  "locked": false,
  "clip": "ryo-spirit-wave",
  "rules": ["A1", "A4", "A5", "A12", "F2", "K1", "K2"],
  "input": {
    "kata": { "slot": "A", "motion": "236" },
    "kihon": { "slot": "A", "direction": "neutral" }
  },
  "card": {
    "plain": "Throw a wave of spirit ink across the screen.",
    "frames": "13 / — / 30 frames, 60 damage, projectile"
  },
  "ex": {
    "meter_cost": 100,
    "changes": [
      { "target": "projectile.hits", "op": "set", "value": 2 }
    ]
  },
  "levels": {
    "1": {
      "frame_data": {
        "startup": 13,
        "active": null,
        "recovery": 30,
        "damage": 60,
        "hitboxes": [],
        "hurtboxes": [
          { "frames": [1, 43], "rect": { "x": -40, "y": 0, "w": 90, "h": 180 } }
        ],
        "cancel_windows": [
          { "frames": [14, 20], "on": ["hit", "block", "whiff"] }
        ],
        "properties": {
          "projectile": {
            "spawn_frame": 14,
            "speed": 8,
            "hitbox": { "x": 60, "y": 80, "w": 60, "h": 50 },
            "hits": 1
          }
        }
      },
      "preset": "spirit-wave-lv1"
    },
    "2": {
      "status": "proposed",
      "tuning": { "target": "recovery", "op": "add", "value": -4 },
      "notes": "Open question: exact Lv 2 step per special (rules.md). Placeholder uses the A4 example."
    },
    "3": {
      "evolution": {
        "id": "great-wave",
        "name": "Great Wave",
        "preset": "great-wave",
        "changes": [
          { "target": "projectile.absorbs_projectiles", "op": "set", "value": 1 }
        ],
        "card": {
          "plain": "Your wave swallows one enemy projectile and keeps going.",
          "frames": "13 / — / 30 frames, 60 damage, absorbs 1 projectile"
        }
      }
    }
  }
}
