{
  "kind": "special",
  "id": "spirit-wave",
  "name": "Spirit Wave",
  "status": "proposed",
  "source": "ryo",
  "starter": true,
  "rarity": "common",
  "locked": false,
  "clip": "ryo-spirit-wave-cast",
  "rules": [
    "A1",
    "A3",
    "A4",
    "A5",
    "C5",
    "E1",
    "E16",
    "E17",
    "F2",
    "F3",
    "K1",
    "K2",
    "K3",
    "V8"
  ],
  "input": {
    "kata": {
      "slot": "A",
      "motion": "236"
    },
    "kihon": {
      "slot": "A",
      "direction": "neutral"
    }
  },
  "card": {
    "plain": "Throw a wave of spirit ink across the screen.",
    "frames": "13 / - / 45 frames, 60 damage, projectile"
  },
  "ex": {
    "meter_cost": 100,
    "changes": [
      {
        "target": "projectile.hits",
        "op": "set",
        "value": 2
      },
      {
        "target": "projectile.speed",
        "op": "add",
        "value": 4
      }
    ]
  },
  "levels": {
    "1": {
      "frame_data": {
        "startup": 13,
        "active": null,
        "recovery": 45,
        "damage": 60,
        "hitstun": 20,
        "blockstun": 16,
        "hitboxes": [],
        "hurtboxes": [
          {
            "frames": [
              1,
              58
            ],
            "rect": {
              "x": -45,
              "y": 0,
              "w": 90,
              "h": 360
            }
          },
          {
            "frames": [
              12,
              40
            ],
            "rect": {
              "x": 40,
              "y": 250,
              "w": 130,
              "h": 50
            }
          }
        ],
        "properties": {
          "projectile": {
            "spawn_frame": 14,
            "speed": 12,
            "hitbox": {
              "x": 60,
              "y": 230,
              "w": 70,
              "h": 70
            },
            "hits": 1
          }
        }
      },
      "preset": "spirit-wave-lv1"
    },
    "2": {
      "status": "proposed",
      "tuning": {
        "target": "recovery",
        "op": "add",
        "value": -4
      },
      "notes": "Placeholder only (the A4 example step). Real Lv 2 steps are YOK-43's proposals; the designer decides in YOK-41. Not written by YOK-33."
    },
    "3": {
      "evolution": {
        "id": "great-wave",
        "name": "Great Wave",
        "status": "proposed",
        "preset": "great-wave",
        "changes": [
          {
            "target": "projectile.absorbs_projectiles",
            "op": "set",
            "value": 1
          }
        ],
        "card": {
          "plain": "Your wave swallows one enemy projectile and keeps going.",
          "frames": "Absorbs 1 projectile"
        }
      }
    }
  },
  "notes": "Startup 13 = table. Recovery is clip-derived: clip frames_total 58 - startup 13 = 45; table target 30 (43 total; the clip spec said blend out earlier). The clip wins (F2); recommend clip-matcher cut the tail. Projectile spawns on frame 14 (clip: release at raw 31). Projectile speed 12, its box (a ball at shoulder height where the hand whips out), stun values and the EX (two hits, +4 speed, 100 meter per E16/C5) are first passes. Lv 2 and Lv 3 are placeholders from other tickets."
}
